{
  "latus": 15,
  "murus": "perimeter",
  "positiones": {
    "U001": [
      7,
      7
    ],
    "A001": [
      4,
      7
    ],
    "A002": [
      5,
      5
    ],
    "A003": [
      7,
      4
    ],
    "A004": [
      9,
      5
    ],
    "A005": [
      10,
      7
    ],
    "A006": [
      10,
      9
    ],
    "A007": [
      9,
      10
    ],
    "A008": [
      7,
      10
    ],
    "A009": [
      5,
      10
    ],
    "A010": [
      4,
      9
    ],
    "S001": [
      3,
      3
    ],
    "S002": [
      11,
      3
    ],
    "S003": [
      6,
      6
    ],
    "S004": [
      8,
      8
    ],
    "S005": [
      2,
      11
    ],
    "S006": [
      12,
      5
    ],
    "S007": [
      4,
      12
    ],
    "S008": [
      11,
      11
    ]
  },
  "sapientum": {
    "dalekus": "openai/gpt-5.4",
    "ursus": "openai/gpt-5.4"
  }
}
